original_sentence	e1	e2	relation_type	metadata	preprocessed_sentence
First, we present a new paradigm for speaker-independent (SI) training of hidden Markov models (HMM) , which uses a large amount of speech from a few speakers instead of the traditional practice of using a little speech from many speakers .	speech	speaker-independent (SI) training	usage	{'e1': {'word': 'speech', 'word_index': [(22, 22)], 'id': 'H90-1060.4'}, 'e2': {'word': 'speaker-independent (SI) training', 'word_index': [(5, 11)], 'id': 'H90-1060.2'}}	First , present new paradigm speaker - independent ( SI ) training hidden Markov models ( HMM ) , uses large amount speech speakers instead traditional practice using little speech many speakers .
In addition, combination of the training speakers is done by averaging the statistics of independently trained models rather than the usual pooling of all the speech data from many speakers prior to training .	statistics	speech data	compare	{'e1': {'word': 'statistics', 'word_index': [(7, 7)], 'id': 'H90-1060.9'}, 'e2': {'word': 'speech data', 'word_index': [(14, 15)], 'id': 'H90-1060.11'}}	addition , combination training speakers done averaging statistics independently trained models rather usual pooling speech data many speakers prior training .
With only 12 training speakers for SI recognition , we achieved a 7.5% word error rate on a standard grammar and test set from the DARPA Resource Management corpus .	training speakers	word error rate	result	{'e1': {'word': 'training speakers', 'word_index': [(1, 2)], 'id': 'H90-1060.14'}, 'e2': {'word': 'word error rate', 'word_index': [(9, 11)], 'id': 'H90-1060.16'}}	12 training speakers SI recognition , achieved 7.5 % word error rate standard grammar test set DARPA Resource Management corpus .
With only 12 training speakers for SI recognition , we achieved a 7.5% word error rate on a standard grammar and test set from the DARPA Resource Management corpus .	test set	DARPA Resource Management corpus	part_whole	{'e1': {'word': 'test set', 'word_index': [(14, 15)], 'id': 'H90-1060.18'}, 'e2': {'word': 'DARPA Resource Management corpus', 'word_index': [(16, 19)], 'id': 'H90-1060.19'}}	12 training speakers SI recognition , achieved 7.5 % word error rate standard grammar test set DARPA Resource Management corpus .
Second, we show a significant improvement for speaker adaptation (SA) using the new SI corpus and a small amount of speech from the new (target) speaker .	SI corpus	speaker adaptation (SA)	usage	{'e1': {'word': 'SI corpus', 'word_index': [(12, 13)], 'id': 'H90-1060.23'}, 'e2': {'word': 'speaker adaptation (SA)', 'word_index': [(5, 9)], 'id': 'H90-1060.22'}}	Second , show significant improvement speaker adaptation ( SA ) using new SI corpus small amount speech new ( target ) speaker .
A probabilistic spectral mapping is estimated independently for each training (reference) speaker and the target speaker .	probabilistic spectral mapping	training (reference) speaker	model-feature	{'e1': {'word': 'probabilistic spectral mapping', 'word_index': [(0, 2)], 'id': 'H90-1060.26'}, 'e2': {'word': 'training (reference) speaker', 'word_index': [(5, 9)], 'id': 'H90-1060.27'}}	probabilistic spectral mapping estimated independently training ( reference ) speaker target speaker .
Each reference model is transformed to the space of the target speaker and combined by averaging .	averaging	reference model	usage	{'e1': {'word': 'averaging', 'word_index': [(7, 7)], 'id': 'H90-1060.32'}, 'e2': {'word': 'reference model', 'word_index': [(0, 1)], 'id': 'H90-1060.29'}}	reference model transformed space target speaker combined averaging .
Using only 40 utterances from the target speaker for adaptation , the error rate dropped to 4.1% --- a 45% reduction in error compared to the SI result.	utterances	adaptation	usage	{'e1': {'word': 'utterances', 'word_index': [(2, 2)], 'id': 'H90-1060.33'}, 'e2': {'word': 'adaptation', 'word_index': [(5, 5)], 'id': 'H90-1060.35'}}	Using 40 utterances target speaker adaptation , error rate dropped 4.1 % --- 45 % reduction error compared SI result .
 This paper presents a specialized editor for a highly structured dictionary .	editor	dictionary	usage	{'e1': {'word': 'editor', 'word_index': [(3, 3)], 'id': 'J90-3002.1'}, 'e2': {'word': 'dictionary', 'word_index': [(6, 6)], 'id': 'J90-3002.2'}}	paper presents specialized editor highly structured dictionary .
The basic goal in building that editor was to provide an adequate tool to help lexicologists produce a valid and coherent dictionary on the basis of a linguistic theory .	editor	lexicologists	usage	{'e1': {'word': 'editor', 'word_index': [(3, 3)], 'id': 'J90-3002.3'}, 'e2': {'word': 'lexicologists', 'word_index': [(8, 8)], 'id': 'J90-3002.4'}}	basic goal building editor provide adequate tool help lexicologists produce valid coherent dictionary basis linguistic theory .
The basic goal in building that editor was to provide an adequate tool to help lexicologists produce a valid and coherent dictionary on the basis of a linguistic theory .	linguistic theory	dictionary	usage	{'e1': {'word': 'linguistic theory', 'word_index': [(14, 15)], 'id': 'J90-3002.6'}, 'e2': {'word': 'dictionary', 'word_index': [(12, 12)], 'id': 'J90-3002.5'}}	basic goal building editor provide adequate tool help lexicologists produce valid coherent dictionary basis linguistic theory .
If we want valuable lexicons and grammars to achieve complex natural language processing , we must provide very powerful tools to help create and ensure the validity of such complex linguistic databases .	grammars	natural language processing	usage	{'e1': {'word': 'grammars', 'word_index': [(3, 3)], 'id': 'J90-3002.8'}, 'e2': {'word': 'natural language processing', 'word_index': [(6, 8)], 'id': 'J90-3002.9'}}	want valuable lexicons grammars achieve complex natural language processing , must provide powerful tools help create ensure validity complex linguistic databases .
 The principle known as free indexation plays an important role in the determination of the referential properties of noun phrases in the principle-and-parameters language framework .	free indexation	referential properties of noun phrases	result	{'e1': {'word': 'free indexation', 'word_index': [(2, 3)], 'id': 'P90-1014.1'}, 'e2': {'word': 'referential properties of noun phrases', 'word_index': [(8, 11)], 'id': 'P90-1014.2'}}	principle known free indexation plays important role determination referential properties noun phrases principle - - parameters language framework .
We describe three techniques for making syntactic analysis more robust---an agenda-based scheduling parser , a recovery technique for failed parses , and a new technique called terminal substring parsing .	agenda-based scheduling parser	syntactic analysis	usage	{'e1': {'word': 'agenda-based scheduling parser', 'word_index': [(8, 12)], 'id': 'A92-1026.6'}, 'e2': {'word': 'syntactic analysis', 'word_index': [(4, 5)], 'id': 'A92-1026.5'}}	describe three techniques making syntactic analysis robust --- agenda - based scheduling parser , recovery technique failed parses , new technique called terminal substring parsing .
For pragmatics processing , we describe how the method of abductive inference is inherently robust, in that an interpretation is always possible, so that in the absence of the required world knowledge , performance degrades gracefully.	abductive inference	pragmatics processing	usage	{'e1': {'word': 'abductive inference', 'word_index': [(5, 6)], 'id': 'A92-1026.10'}, 'e2': {'word': 'pragmatics processing', 'word_index': [(0, 1)], 'id': 'A92-1026.9'}}	pragmatics processing , describe method abductive inference inherently robust , interpretation always possible , absence required world knowledge , performance degrades gracefully .
 We present an efficient algorithm for chart-based phrase structure parsing of natural language that is tailored to the problem of extracting specific information from unrestricted texts where many of the words are unknown and much of the text is irrelevant to the task.	chart-based phrase structure parsing	natural language	usage	{'e1': {'word': 'chart-based phrase structure parsing', 'word_index': [(3, 8)], 'id': 'A92-1027.1'}, 'e2': {'word': 'natural language', 'word_index': [(9, 10)], 'id': 'A92-1027.2'}}	present efficient algorithm chart - based phrase structure parsing natural language tailored problem extracting specific information unrestricted texts many words unknown much text irrelevant task .
 We present an efficient algorithm for chart-based phrase structure parsing of natural language that is tailored to the problem of extracting specific information from unrestricted texts where many of the words are unknown and much of the text is irrelevant to the task.	words	unrestricted texts	part_whole	{'e1': {'word': 'words', 'word_index': [(19, 19)], 'id': 'A92-1027.4'}, 'e2': {'word': 'unrestricted texts', 'word_index': [(16, 17)], 'id': 'A92-1027.3'}}	present efficient algorithm chart - based phrase structure parsing natural language tailored problem extracting specific information unrestricted texts many words unknown much text irrelevant task .
As each new edge is added to the chart , the algorithm checks only the topmost of the edges adjacent to it, rather than all such edges as in conventional treatments.	edges	edges	compare	{'e1': {'word': 'edges', 'word_index': [(8, 8)], 'id': 'A92-1027.11'}, 'e2': {'word': 'edges', 'word_index': [(12, 12)], 'id': 'A92-1027.12'}}	new edge added chart , algorithm checks topmost edges adjacent , rather edges conventional treatments .
This is facilitated through the use of phrase boundary heuristics based on the placement of function words , and by heuristic rules that permit certain kinds of phrases to be deduced despite the presence of unknown words .	function words	phrase boundary heuristics	usage	{'e1': {'word': 'function words', 'word_index': [(7, 8)], 'id': 'A92-1027.18'}, 'e2': {'word': 'phrase boundary heuristics', 'word_index': [(2, 4)], 'id': 'A92-1027.17'}}	facilitated use phrase boundary heuristics based placement function words , heuristic rules permit certain kinds phrases deduced despite presence unknown words .
This is facilitated through the use of phrase boundary heuristics based on the placement of function words , and by heuristic rules that permit certain kinds of phrases to be deduced despite the presence of unknown words .	unknown words	phrases	part_whole	{'e1': {'word': 'unknown words', 'word_index': [(19, 20)], 'id': 'A92-1027.21'}, 'e2': {'word': 'phrases', 'word_index': [(15, 15)], 'id': 'A92-1027.20'}}	facilitated use phrase boundary heuristics based placement function words , heuristic rules permit certain kinds phrases deduced despite presence unknown words .
A further reduction in the search space is achieved by using semantic rather than syntactic categories on the terminal and non-terminal edges , thereby reducing the amount of ambiguity and thus the number of edges , since only edges with a valid semantic interpretation are ever introduced.	semantic	syntactic categories	compare	{'e1': {'word': 'semantic', 'word_index': [(5, 5)], 'id': 'A92-1027.23'}, 'e2': {'word': 'syntactic categories', 'word_index': [(7, 8)], 'id': 'A92-1027.24'}}	reduction search space achieved using semantic rather syntactic categories terminal non-terminal edges , thereby reducing amount ambiguity thus number edges , since edges valid semantic interpretation ever introduced .
A further reduction in the search space is achieved by using semantic rather than syntactic categories on the terminal and non-terminal edges , thereby reducing the amount of ambiguity and thus the number of edges , since only edges with a valid semantic interpretation are ever introduced.	ambiguity	edges	result	{'e1': {'word': 'ambiguity', 'word_index': [(16, 16)], 'id': 'A92-1027.26'}, 'e2': {'word': 'edges', 'word_index': [(19, 19)], 'id': 'A92-1027.27'}}	reduction search space achieved using semantic rather syntactic categories terminal non-terminal edges , thereby reducing amount ambiguity thus number edges , since edges valid semantic interpretation ever introduced .
A further reduction in the search space is achieved by using semantic rather than syntactic categories on the terminal and non-terminal edges , thereby reducing the amount of ambiguity and thus the number of edges , since only edges with a valid semantic interpretation are ever introduced.	semantic	edges	model-feature	{'e1': {'word': 'semantic', 'word_index': [(24, 24)], 'id': 'A92-1027.29'}, 'e2': {'word': 'edges', 'word_index': [(22, 22)], 'id': 'A92-1027.28'}}	reduction search space achieved using semantic rather syntactic categories terminal non-terminal edges , thereby reducing amount ambiguity thus number edges , since edges valid semantic interpretation ever introduced .
 In this paper discourse segments are defined and a method for discourse segmentation primarily based on abduction of temporal relations between segments is proposed.	abduction	discourse segmentation	usage	{'e1': {'word': 'abduction', 'word_index': [(9, 9)], 'id': 'C92-1052.3'}, 'e2': {'word': 'discourse segmentation', 'word_index': [(5, 6)], 'id': 'C92-1052.2'}}	paper discourse segments defined method discourse segmentation primarily based abduction temporal relations segments proposed .
 In this paper discourse segments are defined and a method for discourse segmentation primarily based on abduction of temporal relations between segments is proposed.	temporal relations	segments	model-feature	{'e1': {'word': 'temporal relations', 'word_index': [(10, 11)], 'id': 'C92-1052.4'}, 'e2': {'word': 'segments', 'word_index': [(12, 12)], 'id': 'C92-1052.5'}}	paper discourse segments defined method discourse segmentation primarily based abduction temporal relations segments proposed .
 In this paper, a discrimination and robustness oriented adaptive learning procedure is proposed to deal with the task of syntactic ambiguity resolution .	adaptive learning procedure	syntactic ambiguity resolution	usage	{'e1': {'word': 'adaptive learning procedure', 'word_index': [(5, 7)], 'id': 'C92-1055.1'}, 'e2': {'word': 'syntactic ambiguity resolution', 'word_index': [(11, 13)], 'id': 'C92-1055.2'}}	paper , discrimination robustness oriented adaptive learning procedure proposed deal task syntactic ambiguity resolution .
Owing to the problem of insufficient training data and approximation error introduced by the language model , traditional statistical approaches , which resolve ambiguities by indirectly and implicitly using maximum likelihood method , fail to achieve high performance in real applications.	language model	approximation error	result	{'e1': {'word': 'language model', 'word_index': [(8, 9)], 'id': 'C92-1055.5'}, 'e2': {'word': 'approximation error', 'word_index': [(5, 6)], 'id': 'C92-1055.4'}}	Owing problem insufficient training data approximation error introduced language model , traditional statistical approaches , resolve ambiguities indirectly implicitly using maximum likelihood method , fail achieve high performance real applications .
Owing to the problem of insufficient training data and approximation error introduced by the language model , traditional statistical approaches , which resolve ambiguities by indirectly and implicitly using maximum likelihood method , fail to achieve high performance in real applications.	maximum likelihood method	statistical approaches	usage	{'e1': {'word': 'maximum likelihood method', 'word_index': [(20, 22)], 'id': 'C92-1055.8'}, 'e2': {'word': 'statistical approaches', 'word_index': [(12, 13)], 'id': 'C92-1055.6'}}	Owing problem insufficient training data approximation error introduced language model , traditional statistical approaches , resolve ambiguities indirectly implicitly using maximum likelihood method , fail achieve high performance real applications .
The accuracy rate of syntactic disambiguation is raised from 46.0% to 60.62% by using this novel approach.	syntactic disambiguation	accuracy rate	result	{'e1': {'word': 'syntactic disambiguation', 'word_index': [(2, 3)], 'id': 'C92-1055.14'}, 'e2': {'word': 'accuracy rate', 'word_index': [(0, 1)], 'id': 'C92-1055.13'}}	accuracy rate syntactic disambiguation raised 46.0 % 60.62 % using novel approach .
 Graph unification remains the most expensive part of unification-based grammar parsing .	Graph unification	unification-based grammar parsing	part_whole	{'e1': {'word': 'Graph unification', 'word_index': [(0, 1)], 'id': 'C92-2068.1'}, 'e2': {'word': 'unification-based grammar parsing', 'word_index': [(5, 9)], 'id': 'C92-2068.2'}}	Graph unification remains expensive part unification - based grammar parsing .
We propose a method of attaining such a design through a method of structure-sharing which avoids log(d) overheads often associated with structure-sharing of graphs without any use of costly dependency pointers .	log(d) overheads	structure-sharing of graphs	model-feature	{'e1': {'word': 'log(d) overheads', 'word_index': [(9, 12)], 'id': 'C92-2068.7'}, 'e2': {'word': 'structure-sharing of graphs', 'word_index': [(15, 18)], 'id': 'C92-2068.8'}}	propose method attaining design method structure - sharing avoids log ( ) overheads often associated structure - sharing graphs without use costly dependency pointers .
 The transfer phase in machine translation (MT) systems has been considered to be more complicated than analysis and generation , since it is inherently a conglomeration of individual lexical rules .	transfer phase	analysis	compare	{'e1': {'word': 'transfer phase', 'word_index': [(0, 1)], 'id': 'C92-2115.1'}, 'e2': {'word': 'analysis', 'word_index': [(10, 10)], 'id': 'C92-2115.3'}}	transfer phase machine translation ( MT ) systems considered complicated analysis generation , since inherently conglomeration individual lexical rules .
Currently some attempts are being made to use case-based reasoning in machine translation , that is, to make decisions on the basis of translation examples at appropriate pints in MT .	case-based reasoning	machine translation	usage	{'e1': {'word': 'case-based reasoning', 'word_index': [(4, 7)], 'id': 'C92-2115.6'}, 'e2': {'word': 'machine translation', 'word_index': [(8, 9)], 'id': 'C92-2115.7'}}	Currently attempts made use case - based reasoning machine translation , , make decisions basis translation examples appropriate pints MT .
This paper proposes a new type of transfer system , called a Similarity-driven Transfer System (SimTran) , for use in such case-based MT (CBMT) .	Similarity-driven Transfer System (SimTran)	case-based MT (CBMT)	usage	{'e1': {'word': 'Similarity-driven Transfer System (SimTran)', 'word_index': [(8, 14)], 'id': 'C92-2115.11'}, 'e2': {'word': 'case-based MT (CBMT)', 'word_index': [(18, 24)], 'id': 'C92-2115.12'}}	paper proposes new type transfer system , called Similarity -driven Transfer System ( SimTran ) , for in case - based MT ( CBMT ) .
When a very noisy portion is detected, the parser skips that portion using a fake non-terminal symbol .	non-terminal symbol	parser	usage	{'e1': {'word': 'non-terminal symbol', 'word_index': [(9, 10)], 'id': 'C92-3165.7'}, 'e2': {'word': 'parser', 'word_index': [(4, 4)], 'id': 'C92-3165.5'}}	noisy portion detected , parser skips portion using fake non-terminal symbol .
The unidentified portion is resolved by re-utterance of that portion which is parsed very efficiently by using the parse record of the first utterance .	parse record	utterance	model-feature	{'e1': {'word': 'parse record', 'word_index': [(8, 9)], 'id': 'C92-3165.11'}, 'e2': {'word': 'utterance', 'word_index': [(11, 11)], 'id': 'C92-3165.12'}}	unidentified portion resolved re-utterance portion parsed efficiently using parse record first utterance .
Detected unknown words can be incrementally incorporated into the dictionary after the interaction with the user .	unknown words	dictionary	part_whole	{'e1': {'word': 'unknown words', 'word_index': [(1, 2)], 'id': 'C92-3165.16'}, 'e2': {'word': 'dictionary', 'word_index': [(5, 5)], 'id': 'C92-3165.17'}}	Detected unknown words incrementally incorporated dictionary interaction user .
In this paper, a new mechanism, based on the concept of sublanguage , is proposed for identifying unknown words , especially personal names , in Chinese newspapers .	sublanguage	unknown words	usage	{'e1': {'word': 'sublanguage', 'word_index': [(7, 7)], 'id': 'C92-4199.3'}, 'e2': {'word': 'unknown words', 'word_index': [(11, 12)], 'id': 'C92-4199.4'}}	paper , new mechanism , based concept sublanguage , proposed identifying unknown words , especially personal names , Chinese newspapers .
In this paper, a new mechanism, based on the concept of sublanguage , is proposed for identifying unknown words , especially personal names , in Chinese newspapers .	personal names	Chinese newspapers	part_whole	{'e1': {'word': 'personal names', 'word_index': [(15, 16)], 'id': 'C92-4199.5'}, 'e2': {'word': 'Chinese newspapers', 'word_index': [(18, 19)], 'id': 'C92-4199.6'}}	paper , new mechanism , based concept sublanguage , proposed identifying unknown words , especially personal names , Chinese newspapers .
 This paper describes the understanding process of the spatial descriptions in Japanese .	spatial descriptions	Japanese	part_whole	{'e1': {'word': 'spatial descriptions', 'word_index': [(4, 5)], 'id': 'C92-4207.1'}, 'e2': {'word': 'Japanese', 'word_index': [(6, 6)], 'id': 'C92-4207.2'}}	paper describes understanding process spatial descriptions Japanese .
It is done by an experimental computer program SPRINT , which takes natural language texts and produces a model of the described world .	model	world	model-feature	{'e1': {'word': 'model', 'word_index': [(11, 11)], 'id': 'C92-4207.7'}, 'e2': {'word': 'world', 'word_index': [(13, 13)], 'id': 'C92-4207.8'}}	done experimental computer program SPRINT , takes natural language texts produces model described world .
To reconstruct the model , the authors extract the qualitative spatial constraints from the text , and represent them as the numerical constraints on the spatial attributes of the entities .	qualitative spatial constraints	text	part_whole	{'e1': {'word': 'qualitative spatial constraints', 'word_index': [(5, 7)], 'id': 'C92-4207.10'}, 'e2': {'word': 'text', 'word_index': [(8, 8)], 'id': 'C92-4207.11'}}	reconstruct model , authors extract qualitative spatial constraints text , represent numerical constraints spatial attributes entities .
To reconstruct the model , the authors extract the qualitative spatial constraints from the text , and represent them as the numerical constraints on the spatial attributes of the entities .	spatial attributes	entities	model-feature	{'e1': {'word': 'spatial attributes', 'word_index': [(13, 14)], 'id': 'C92-4207.13'}, 'e2': {'word': 'entities', 'word_index': [(15, 15)], 'id': 'C92-4207.14'}}	reconstruct model , authors extract qualitative spatial constraints text , represent numerical constraints spatial attributes entities .
The interpretation reflects the temporary belief about the world .	temporary belief	world	model-feature	{'e1': {'word': 'temporary belief', 'word_index': [(2, 3)], 'id': 'C92-4207.16'}, 'e2': {'word': 'world', 'word_index': [(4, 4)], 'id': 'C92-4207.17'}}	interpretation reflects temporary belief world .
 This paper describes a recently collected spoken language corpus for the ATIS (Air Travel Information System) domain .	ATIS (Air Travel Information System) domain	spoken language corpus	model-feature	{'e1': {'word': 'ATIS (Air Travel Information System) domain', 'word_index': [(7, 14)], 'id': 'H92-1003.2'}, 'e2': {'word': 'spoken language corpus', 'word_index': [(4, 6)], 'id': 'H92-1003.1'}}	paper describes recently collected spoken language corpus ATIS ( Air Travel Information System ) domain .
We summarize the motivation for this effort, the goals, the implementation of a multi-site data collection paradigm , and the accomplishments of MADCOW in monitoring the collection and distribution of 12,000 utterances of spontaneous speech from five sites for use in a multi-site common evaluation of speech, natural language and spoken language .</abstract>	spontaneous speech	utterances	model-feature	{'e1': {'word': 'spontaneous speech', 'word_index': [(19, 20)], 'id': 'H92-1003.8'}, 'e2': {'word': 'utterances', 'word_index': [(18, 18)], 'id': 'H92-1003.7'}}	summarize motivation effort , goals , implementation multi-site data collection paradigm , accomplishments MADCOW monitoring collection distribution 12,000 utterances spontaneous speech five sites use multi-site common evaluation speech , natural language spoken language .< / abstract >
 The paper provides an overview of the research conducted at LIMSI in the field of speech processing , but also in the related areas of Human-Machine Communication , including Natural Language Processing , Non Verbal and Multimodal Communication .	speech processing	Human-Machine Communication	compare	{'e1': {'word': 'speech processing', 'word_index': [(7, 8)], 'id': 'H92-1010.2'}, 'e2': {'word': 'Human-Machine Communication', 'word_index': [(13, 16)], 'id': 'H92-1010.3'}}	paper provides overview research conducted LIMSI field speech processing , also related areas Human - Machine Communication , including Natural Language Processing , Non Verbal Multimodal Communication .
