original_sentence	e1	e2	relation_type	metadata	preprocessed_sentence
Dictionary construction, one of the most difficult tasks in developing a machine translation system, is expensive.	Dictionary construction	machine translation system	part_whole	{'e1': {'word': 'Dictionary construction', 'word_index': [(0, 1)], 'id': 'W04-2204.2'}, 'e2': {'word': 'machine translation system', 'word_index': [(7, 9)], 'id': 'W04-2204.3'}}	Dictionary construction , one difficult tasks developing machine translation system , expensive .
To avoid this problem, we investigate how we build a dictionary using existing linguistic resources.	linguistic resources	dictionary	usage	{'e1': {'word': 'linguistic resources', 'word_index': [(8, 9)], 'id': 'W04-2204.5'}, 'e2': {'word': 'dictionary', 'word_index': [(5, 5)], 'id': 'W04-2204.4'}}	avoid problem , investigate build dictionary using existing linguistic resources .
Our algorithm can be applied to any language pairs, but for the present we focus on building a Korean-to-Japanese dictionary using English as a pivot.	algorithm	language pairs	usage	{'e1': {'word': 'algorithm', 'word_index': [(0, 0)], 'id': 'W04-2204.6'}, 'e2': {'word': 'language pairs', 'word_index': [(2, 3)], 'id': 'W04-2204.7'}}	algorithm applied language pairs , present focus building Korean - - Japanese dictionary using English pivot .
Our algorithm can be applied to any language pairs, but for the present we focus on building a Korean-to-Japanese dictionary using English as a pivot.	pivot	Korean-to-Japanese dictionary	usage	{'e1': {'word': 'pivot', 'word_index': [(15, 15)], 'id': 'W04-2204.10'}, 'e2': {'word': 'Korean-to-Japanese dictionary', 'word_index': [(8, 12)], 'id': 'W04-2204.8'}}	algorithm applied language pairs , present focus building Korean - - Japanese dictionary using English pivot .
We attempt three ways of automatic construction to corroborate the effect of the directionality of dictionaries.	directionality	dictionaries	model-feature	{'e1': {'word': 'directionality', 'word_index': [(7, 7)], 'id': 'W04-2204.12'}, 'e2': {'word': 'dictionaries', 'word_index': [(8, 8)], 'id': 'W04-2204.13'}}	attempt three ways automatic construction corroborate effect directionality dictionaries .
"First, we introduce ""one-time look up"" method using a Korean-to-English and a Japanese-to-English dictionary."	Korean-to-English and a Japanese-to-English dictionary	"""one-time look up"" method"	usage	"{'e1': {'word': 'Korean-to-English and a Japanese-to-English dictionary', 'word_index': [(11, 19)], 'id': 'W04-2204.15'}, 'e2': {'word': '""one-time look up"" method', 'word_index': [(3, 9)], 'id': 'W04-2204.14'}}"	"First , introduce "" one - time look "" method using Korean - - English Japanese - - English dictionary ."
We present an approach to annotating a level of discourse structure that is based on identifying discourse connectives and their arguments.	discourse connectives	discourse structure	usage	{'e1': {'word': 'discourse connectives', 'word_index': [(8, 9)], 'id': 'W04-2703.4'}, 'e2': {'word': 'discourse structure', 'word_index': [(4, 5)], 'id': 'W04-2703.3'}}	present approach annotating level discourse structure based identifying discourse connectives arguments .
In this paper, we present a fully automated extraction system, named IntEx, to identify gene and protein interactions in biomedical text.	gene and protein interactions	biomedical text	part_whole	{'e1': {'word': 'gene and protein interactions', 'word_index': [(12, 14)], 'id': 'W05-1308.3'}, 'e2': {'word': 'biomedical text', 'word_index': [(15, 16)], 'id': 'W05-1308.4'}}	paper , present fully automated extraction system , named IntEx , identify gene protein interactions biomedical text .
Our approach is based on first splitting complex sentences into simple clausal structures made up of syntactic roles.	simple clausal structures	complex sentences	part_whole	{'e1': {'word': 'simple clausal structures', 'word_index': [(6, 8)], 'id': 'W05-1308.6'}, 'e2': {'word': 'complex sentences', 'word_index': [(4, 5)], 'id': 'W05-1308.5'}}	approach based first splitting complex sentences simple clausal structures made syntactic roles .
Then, tagging biological entities with the help of biomedical and linguistic ontologies.	biomedical and linguistic ontologies	biological entities	model-feature	{'e1': {'word': 'biomedical and linguistic ontologies', 'word_index': [(5, 7)], 'id': 'W05-1308.9'}, 'e2': {'word': 'biological entities', 'word_index': [(2, 3)], 'id': 'W05-1308.8'}}	, tagging biological entities help biomedical linguistic ontologies .
Our extraction system handles complex sentences and extracts multiple and nested interactions specified in a sentence.	extraction system	complex sentences	usage	{'e1': {'word': 'extraction system', 'word_index': [(0, 1)], 'id': 'W05-1308.12'}, 'e2': {'word': 'complex sentences', 'word_index': [(3, 4)], 'id': 'W05-1308.13'}}	extraction system handles complex sentences extracts multiple nested interactions specified sentence .
Our extraction system handles complex sentences and extracts multiple and nested interactions specified in a sentence.	multiple and nested interactions	sentence	part_whole	{'e1': {'word': 'multiple and nested interactions', 'word_index': [(6, 8)], 'id': 'W05-1308.14'}, 'e2': {'word': 'sentence', 'word_index': [(10, 10)], 'id': 'W05-1308.15'}}	extraction system handles complex sentences extracts multiple nested interactions specified sentence .
Experimental evaluations with two other state of the art extraction systems indicate that the IntEx system achieves better performance without the labor intensive pattern engineering requirement.	IntEx system	performance	result	{'e1': {'word': 'IntEx system', 'word_index': [(8, 9)], 'id': 'W05-1308.17'}, 'e2': {'word': 'performance', 'word_index': [(12, 12)], 'id': 'W05-1308.18'}}	Experimental evaluations two state art extraction systems indicate IntEx system achieves better performance without labor intensive pattern engineering requirement .
We propose a framework to derive the distance between concepts from distributional measures of word co-occurrences.	distance	concepts	model-feature	{'e1': {'word': 'distance', 'word_index': [(3, 3)], 'id': 'W06-1605.1'}, 'e2': {'word': 'concepts', 'word_index': [(4, 4)], 'id': 'W06-1605.2'}}	propose framework derive distance concepts distributional measures word co-occurrences .
We use the categories in a published thesaurus as coarse-grained concepts, allowing all possible distance values to be stored in a concept-concept matrix roughly.01% the size of that created by existing measures.	categories	thesaurus	part_whole	{'e1': {'word': 'categories', 'word_index': [(1, 1)], 'id': 'W06-1605.4'}, 'e2': {'word': 'thesaurus', 'word_index': [(3, 3)], 'id': 'W06-1605.5'}}	use categories published thesaurus coarse-grained concepts , allowing all distance values to in - concept matrix roughly . 01 % the of by measures .
We use the categories in a published thesaurus as coarse-grained concepts, allowing all possible distance values to be stored in a concept-concept matrix roughly.01% the size of that created by existing measures.	coarse-grained concepts	concept-concept matrix	part_whole	{'e1': {'word': 'coarse-grained concepts', 'word_index': [(4, 5)], 'id': 'W06-1605.6'}, 'e2': {'word': 'concept-concept matrix', 'word_index': [(13, 16)], 'id': 'W06-1605.8'}}	use categories published thesaurus coarse-grained concepts , allowing all distance values to in concept - concept matrix roughly . 01 % the of by measures .
We show that the newly proposed concept-distance measures outperform traditional distributional word-distance measures in the tasks of (1) ranking word pairs in order of semantic distance, and (2) correcting real-word spelling errors.	concept-distance measures	traditional distributional word-distance measures	compare	{'e1': {'word': 'concept-distance measures', 'word_index': [(3, 4)], 'id': 'W06-1605.9'}, 'e2': {'word': 'traditional distributional word-distance measures', 'word_index': [(6, 11)], 'id': 'W06-1605.10'}}	show newly proposed concept-distance measures outperform traditional distributional word - distance measures tasks ( 1 ) ranking word pairs order semantic distance , ( 2 ) correcting real - word spelling errors .
We show that the newly proposed concept-distance measures outperform traditional distributional word-distance measures in the tasks of (1) ranking word pairs in order of semantic distance, and (2) correcting real-word spelling errors.	semantic distance	word pairs	model-feature	{'e1': {'word': 'semantic distance', 'word_index': [(20, 21)], 'id': 'W06-1605.12'}, 'e2': {'word': 'word pairs', 'word_index': [(17, 18)], 'id': 'W06-1605.11'}}	show newly proposed concept-distance measures outperform traditional distributional word - distance measures tasks ( 1 ) ranking word pairs order semantic distance , ( 2 ) correcting real - word spelling errors .
In the latter task, of all the WordNet-based measures, only that proposed by Jiang and Conrath outperforms the best distributional concept-distance measures.	WordNet-based measures	distributional concept-distance measures	compare	{'e1': {'word': 'WordNet-based measures', 'word_index': [(3, 6)], 'id': 'W06-1605.14'}, 'e2': {'word': 'distributional concept-distance measures', 'word_index': [(13, 15)], 'id': 'W06-1605.15'}}	latter task , WordNet - based measures , proposed Jiang Conrath outperforms best distributional concept-distance measures .
We argue in favor of the the use of labeled directed graph to represent various types of linguistic structures, and illustrate how this allows one to view NLP tasks as graph transformations.	labeled directed graph	linguistic structures	model-feature	{'e1': {'word': 'labeled directed graph', 'word_index': [(3, 5)], 'id': 'W07-0208.1'}, 'e2': {'word': 'linguistic structures', 'word_index': [(9, 10)], 'id': 'W07-0208.2'}}	argue favor use labeled directed graph represent various types linguistic structures , illustrate allows one view NLP tasks graph transformations .
We argue in favor of the the use of labeled directed graph to represent various types of linguistic structures, and illustrate how this allows one to view NLP tasks as graph transformations.	graph transformations	NLP tasks	model-feature	{'e1': {'word': 'graph transformations', 'word_index': [(18, 19)], 'id': 'W07-0208.4'}, 'e2': {'word': 'NLP tasks', 'word_index': [(16, 17)], 'id': 'W07-0208.3'}}	argue favor use labeled directed graph represent various types linguistic structures , illustrate allows one view NLP tasks graph transformations .
We present a general method for learning such transformations from an annotated corpus and describe experiments with two applications of the method: identification of non-local depenencies (using Penn Treebank data) and semantic role labeling (using Proposition Bank data).	identification of non-local depenencies	Penn Treebank data	model-feature	{'e1': {'word': 'identification of non-local depenencies', 'word_index': [(13, 15)], 'id': 'W07-0208.7'}, 'e2': {'word': 'Penn Treebank data', 'word_index': [(18, 20)], 'id': 'W07-0208.8'}}	present general method learning transformations annotated corpus describe experiments two applications method : identification non-local depenencies ( using Penn Treebank data ) semantic role labeling ( using Proposition Bank data ) .
We present a general method for learning such transformations from an annotated corpus and describe experiments with two applications of the method: identification of non-local depenencies (using Penn Treebank data) and semantic role labeling (using Proposition Bank data).	semantic role labeling	Proposition Bank data	model-feature	{'e1': {'word': 'semantic role labeling', 'word_index': [(22, 24)], 'id': 'W07-0208.9'}, 'e2': {'word': 'Proposition Bank data', 'word_index': [(27, 29)], 'id': 'W07-0208.10'}}	present general method learning transformations annotated corpus describe experiments two applications method : identification non-local depenencies ( using Penn Treebank data ) semantic role labeling ( using Proposition Bank data ) .
Topical blog post retrieval is the task of ranking blog posts with respect to their relevance for a given topic.	relevance	blog posts	model-feature	{'e1': {'word': 'relevance', 'word_index': [(9, 9)], 'id': 'P08-1105.3'}, 'e2': {'word': 'blog posts', 'word_index': [(6, 7)], 'id': 'P08-1105.2'}}	Topical blog post retrieval task ranking blog posts respect relevance given topic .
To improve topical blog post retrieval we incorporate textual credibility indicators in the retrieval process.	textual credibility indicators	topical blog post retrieval	usage	{'e1': {'word': 'textual credibility indicators', 'word_index': [(6, 8)], 'id': 'P08-1105.6'}, 'e2': {'word': 'topical blog post retrieval', 'word_index': [(1, 4)], 'id': 'P08-1105.5'}}	improve topical blog post retrieval incorporate textual credibility indicators retrieval process .
We describe how to estimate these indicators and how to integrate them into a retrieval approach based on language models.	indicators	retrieval approach	usage	{'e1': {'word': 'indicators', 'word_index': [(2, 2)], 'id': 'P08-1105.11'}, 'e2': {'word': 'retrieval approach', 'word_index': [(4, 5)], 'id': 'P08-1105.12'}}	describe estimate indicators integrate retrieval approach based language models .
Experiments on the TREC Blog track test set show that both groups of credibility indicators significantly improve retrieval effectiveness; the best performance is achieved when combining them.	credibility indicators	retrieval effectiveness	result	{'e1': {'word': 'credibility indicators', 'word_index': [(8, 9)], 'id': 'P08-1105.15'}, 'e2': {'word': 'retrieval effectiveness', 'word_index': [(12, 13)], 'id': 'P08-1105.16'}}	Experiments TREC Blog track test set show groups credibility indicators significantly improve retrieval effectiveness ; best performance achieved combining .
Four problems render vector space model (VSM)-based text classification approach ineffective: 1) Many words within song lyrics actually contribute little to sentiment; 2) Nouns and verbs used to express sentiment are ambiguous; 3) Negations and modifiers around the sentiment keywords make particular contributions to sentiment; 4) Song lyric is usually very short.	words	song lyrics	part_whole	{'e1': {'word': 'words', 'word_index': [(19, 19)], 'id': 'P08-2034.4'}, 'e2': {'word': 'song lyrics', 'word_index': [(21, 22)], 'id': 'P08-2034.5'}}	Four problems render vector space model ( VSM ) - based text classification approach ineffective : 1 ) Many words within song lyrics actually contribute little sentiment ; 2 ) Nouns verbs used express sentiment ambiguous ; 3 ) Negations modifiers around sentiment keywords make particular contributions sentiment ; 4 ) Song lyric usually short .
To address these problems, the sentiment vector space model (s-VSM) is proposed to represent song lyric document.	sentiment vector space model (s-VSM)	song lyric document	model-feature	{'e1': {'word': 'sentiment vector space model (s-VSM)', 'word_index': [(3, 9)], 'id': 'P08-2034.15'}, 'e2': {'word': 'song lyric document', 'word_index': [(12, 14)], 'id': 'P08-2034.16'}}	address problems , sentiment vector space model ( s-VSM ) proposed represent song lyric document .
The preliminary experiments prove that the s-VSM model outperforms the VSM model in the lyric-based song sentiment classification task.	s-VSM model	VSM model	compare	{'e1': {'word': 's-VSM model', 'word_index': [(3, 4)], 'id': 'P08-2034.17'}, 'e2': {'word': 'VSM model', 'word_index': [(6, 7)], 'id': 'P08-2034.18'}}	preliminary experiments prove s-VSM model outperforms VSM model lyric - based song sentiment classification task .
This paper shows that it is very often possible to identify the source language of medium-length speeches in the EUROPARL corpus on the basis of frequency counts of word n-grams (87.2%-96.7% accuracy depending on classification method).	source language	EUROPARL corpus	model-feature	{'e1': {'word': 'source language', 'word_index': [(5, 6)], 'id': 'C08-1118.1'}, 'e2': {'word': 'EUROPARL corpus', 'word_index': [(11, 12)], 'id': 'C08-1118.2'}}	paper shows often possible identify source language medium - length speeches EUROPARL corpus basis frequency counts word n-grams ( 87.2 %-96.7 % accuracy depending on classification ) .
This paper shows that it is very often possible to identify the source language of medium-length speeches in the EUROPARL corpus on the basis of frequency counts of word n-grams (87.2%-96.7% accuracy depending on classification method).	frequency counts	word n-grams	model-feature	{'e1': {'word': 'frequency counts', 'word_index': [(14, 15)], 'id': 'C08-1118.3'}, 'e2': {'word': 'word n-grams', 'word_index': [(16, 17)], 'id': 'C08-1118.4'}}	paper shows often possible identify source language medium - length speeches EUROPARL corpus basis frequency counts word n-grams ( 87.2 %-96.7 % accuracy depending on classification ) .
This paper shows that it is very often possible to identify the source language of medium-length speeches in the EUROPARL corpus on the basis of frequency counts of word n-grams (87.2%-96.7% accuracy depending on classification method).	classification method	accuracy	result	{'e1': {'word': 'classification method', 'word_index': [(25, 25)], 'id': 'C08-1118.6'}, 'e2': {'word': 'accuracy', 'word_index': [(22, 22)], 'id': 'C08-1118.5'}}	paper shows often possible identify source language medium - length speeches EUROPARL corpus basis frequency counts word n-grams ( 87.2 %-96.7 % accuracy depending on method ) .
Words in Chinese text are not naturally separated by delimiters, which poses a challenge to standard machine translation (MT) systems.	Words	Chinese text	part_whole	{'e1': {'word': 'Words', 'word_index': [(0, 0)], 'id': 'C08-1128.1'}, 'e2': {'word': 'Chinese text', 'word_index': [(1, 2)], 'id': 'C08-1128.2'}}	Words Chinese text naturally separated delimiters , poses challenge standard machine translation ( MT ) systems .
In MT, the widely used approach is to apply a Chinese word segmenter trained from manually annotated data, using a fixed lexicon.	Chinese word segmenter	MT	usage	{'e1': {'word': 'Chinese word segmenter', 'word_index': [(6, 8)], 'id': 'C08-1128.6'}, 'e2': {'word': 'MT', 'word_index': [(0, 0)], 'id': 'C08-1128.5'}}	MT , widely used approach apply Chinese word segmenter trained manually annotated data , using fixed lexicon .
We propose a Bayesian semi-supervised Chinese word segmentation model which uses both monolingual and bilingual information to derive a segmentation suitable for MT.	monolingual and bilingual information	Bayesian semi-supervised Chinese word segmentation model	usage	{'e1': {'word': 'monolingual and bilingual information', 'word_index': [(8, 10)], 'id': 'C08-1128.12'}, 'e2': {'word': 'Bayesian semi-supervised Chinese word segmentation model', 'word_index': [(1, 6)], 'id': 'C08-1128.11'}}	propose Bayesian semi-supervised Chinese word segmentation model uses monolingual bilingual information derive segmentation suitable MT .
We propose a Bayesian semi-supervised Chinese word segmentation model which uses both monolingual and bilingual information to derive a segmentation suitable for MT.	segmentation	MT	usage	{'e1': {'word': 'segmentation', 'word_index': [(12, 12)], 'id': 'C08-1128.13'}, 'e2': {'word': 'MT', 'word_index': [(14, 14)], 'id': 'C08-1128.14'}}	propose Bayesian semi-supervised Chinese word segmentation model uses monolingual bilingual information derive segmentation suitable MT .
Indeed, automatic evaluations need high-quality data that allow the comparison of both automatic and human translations.	high-quality data	automatic evaluations	usage	{'e1': {'word': 'high-quality data', 'word_index': [(5, 8)], 'id': 'C08-2010.7'}, 'e2': {'word': 'automatic evaluations', 'word_index': [(2, 3)], 'id': 'C08-2010.6'}}	Indeed , automatic evaluations need high - quality data allow comparison automatic human translations .
This paper describes the impact of using different-quality references on evaluation.	different-quality references	evaluation	usage	{'e1': {'word': 'different-quality references', 'word_index': [(4, 7)], 'id': 'C08-2010.9'}, 'e2': {'word': 'evaluation', 'word_index': [(8, 8)], 'id': 'C08-2010.10'}}	paper describes impact using different - quality references evaluation .
Thus, the limitations of the automatic metrics used within MT are also discussed in this regard.	automatic metrics	MT	usage	{'e1': {'word': 'automatic metrics', 'word_index': [(3, 4)], 'id': 'C08-2010.11'}, 'e2': {'word': 'MT', 'word_index': [(7, 7)], 'id': 'C08-2010.12'}}	Thus , limitations automatic metrics used within MT also discussed regard .
The tool supports queries with an arbitrary number of wildcards.	wildcards	queries	model-feature	{'e1': {'word': 'wildcards', 'word_index': [(5, 5)], 'id': 'C08-3010.4'}, 'e2': {'word': 'queries', 'word_index': [(2, 2)], 'id': 'C08-3010.3'}}	tool supports queries arbitrary number wildcards .
This paper presents an approach to the unsupervised learning of parts of speech which uses both morphological and syntactic information.	morphological and syntactic information	unsupervised learning	usage	{'e1': {'word': 'morphological and syntactic information', 'word_index': [(8, 10)], 'id': 'W03-2907.3'}, 'e2': {'word': 'unsupervised learning', 'word_index': [(3, 4)], 'id': 'W03-2907.1'}}	paper presents approach unsupervised learning parts speech uses morphological syntactic information .
While the model is more complex than those which have been employed for unsupervised learning of POS tags in English, which use only syntactic information, the variety of languages in the world requires that we consider morphology as well.	syntactic information	unsupervised learning	usage	{'e1': {'word': 'syntactic information', 'word_index': [(10, 11)], 'id': 'W03-2907.7'}, 'e2': {'word': 'unsupervised learning', 'word_index': [(3, 4)], 'id': 'W03-2907.5'}}	model complex employed unsupervised learning POS tags English , use syntactic information , variety languages world requires consider morphology well .
While the model is more complex than those which have been employed for unsupervised learning of POS tags in English, which use only syntactic information, the variety of languages in the world requires that we consider morphology as well.	morphology	languages	part_whole	{'e1': {'word': 'morphology', 'word_index': [(18, 18)], 'id': 'W03-2907.9'}, 'e2': {'word': 'languages', 'word_index': [(14, 14)], 'id': 'W03-2907.8'}}	model complex employed unsupervised learning POS tags English , use syntactic information , variety languages world requires consider morphology well .
In many languages, morphology provides better clues to a word's category than word order.	morphology	word order	compare	{'e1': {'word': 'morphology', 'word_index': [(3, 3)], 'id': 'W03-2907.11'}, 'e2': {'word': 'word order', 'word_index': [(10, 11)], 'id': 'W03-2907.12'}}	many languages , morphology provides better clues word 's category word order .
We present the computational model for POS learning, and present results for applying it to Bulgarian, a Slavic language with relatively free word order and rich morphology.	computational model	POS learning	usage	{'e1': {'word': 'computational model', 'word_index': [(1, 2)], 'id': 'W03-2907.13'}, 'e2': {'word': 'POS learning', 'word_index': [(3, 4)], 'id': 'W03-2907.14'}}	present computational model POS learning , present results applying Bulgarian , Slavic language relatively free word order rich morphology .
We present the computational model for POS learning, and present results for applying it to Bulgarian, a Slavic language with relatively free word order and rich morphology.	Bulgarian	free word order	model-feature	{'e1': {'word': 'Bulgarian', 'word_index': [(9, 9)], 'id': 'W03-2907.15'}, 'e2': {'word': 'free word order', 'word_index': [(14, 16)], 'id': 'W03-2907.17'}}	present computational model POS learning , present results applying Bulgarian , Slavic language relatively free word order rich morphology .
We propose a solution to the challenge of the CoNLL 2008 shared task that uses a generative history-based latent variable model to predict the most likely derivation of a synchronous dependency parser for both syntactic and semantic dependencies.	generative history-based latent variable model	CoNLL 2008 shared task	usage	{'e1': {'word': 'generative history-based latent variable model', 'word_index': [(8, 14)], 'id': 'W08-2122.2'}, 'e2': {'word': 'CoNLL 2008 shared task', 'word_index': [(3, 6)], 'id': 'W08-2122.1'}}	propose solution challenge CoNLL 2008 shared task uses generative history - based latent variable model predict likely derivation synchronous dependency parser syntactic semantic dependencies .
We propose a solution to the challenge of the CoNLL 2008 shared task that uses a generative history-based latent variable model to predict the most likely derivation of a synchronous dependency parser for both syntactic and semantic dependencies.	derivation	syntactic and semantic dependencies	model-feature	{'e1': {'word': 'derivation', 'word_index': [(17, 17)], 'id': 'W08-2122.3'}, 'e2': {'word': 'syntactic and semantic dependencies', 'word_index': [(21, 23)], 'id': 'W08-2122.5'}}	propose solution challenge CoNLL 2008 shared task uses generative history - based latent variable model predict likely derivation synchronous dependency parser syntactic semantic dependencies .
The submitted model yields 79.1% macro-average F1 performance, for the joint task, 86.9% syntactic dependencies LAS and 71.0% semantic dependencies F1.	model	macro-average F1 performance	result	{'e1': {'word': 'model', 'word_index': [(1, 1)], 'id': 'W08-2122.6'}, 'e2': {'word': 'macro-average F1 performance', 'word_index': [(5, 7)], 'id': 'W08-2122.7'}}	submitted model yields 79.1 % macro-average F1 performance , joint task , 86.9 % syntactic dependencies LAS 71.0 % semantic dependencies F1 .
