original_sentence	e1	e2	relation_type	metadata	preprocessed_sentence
This paper introduces a simple mixture language model that attempts to capture long distance constraints in a sentence or paragraph.	long distance constraints	sentence	part_whole	{'e1': {'word': 'long distance constraints', 'word_index': [(8, 10)], 'id': 'H94-1014.2'}, 'e2': {'word': 'sentence', 'word_index': [(11, 11)], 'id': 'H94-1014.3'}}	paper introduces simple mixture language model attempts capture long distance constraints sentence paragraph .
Using the BU recognition system, experiments show a 7% improvement in recognition accuracy with the mixture digram models as compared to using a Digram model.	BU recognition system	recognition accuracy	result	{'e1': {'word': 'BU recognition system', 'word_index': [(1, 3)], 'id': 'H94-1014.9'}, 'e2': {'word': 'recognition accuracy', 'word_index': [(10, 11)], 'id': 'H94-1014.10'}}	Using BU recognition system , experiments show 7 % improvement recognition accuracy mixture digram models compared using Digram model .
Using the BU recognition system, experiments show a 7% improvement in recognition accuracy with the mixture digram models as compared to using a Digram model.	mixture digram models	Digram model	compare	{'e1': {'word': 'mixture digram models', 'word_index': [(12, 14)], 'id': 'H94-1014.11'}, 'e2': {'word': 'Digram model', 'word_index': [(17, 18)], 'id': 'H94-1014.12'}}	Using BU recognition system , experiments show 7 % improvement recognition accuracy mixture digram models compared using Digram model .
The identification of unknown proper names in text is a significant challenge for NLP systems operating on unrestricted text.	proper names	text	part_whole	{'e1': {'word': 'proper names', 'word_index': [(2, 3)], 'id': 'W93-0105.1'}, 'e2': {'word': 'text', 'word_index': [(4, 4)], 'id': 'W93-0105.2'}}	identification unknown proper names text significant challenge NLP systems operating unrestricted text .
The identification of unknown proper names in text is a significant challenge for NLP systems operating on unrestricted text.	NLP systems	unrestricted text	usage	{'e1': {'word': 'NLP systems', 'word_index': [(7, 8)], 'id': 'W93-0105.3'}, 'e2': {'word': 'unrestricted text', 'word_index': [(10, 11)], 'id': 'W93-0105.4'}}	identification unknown proper names text significant challenge NLP systems operating unrestricted text .
A system which indexes documents according to name references can be useful for information retrieval or as a preprocessor for more knowledge intensive tasks such as database extraction.	name references	documents	model-feature	{'e1': {'word': 'name references', 'word_index': [(4, 5)], 'id': 'W93-0105.6'}, 'e2': {'word': 'documents', 'word_index': [(2, 2)], 'id': 'W93-0105.5'}}	system indexes documents according name references useful information retrieval preprocessor knowledge intensive tasks database extraction .
This paper describes a system which uses text skimming techniques for deriving proper names and their semantic attributes automatically from newswire text, without relying on any listing of name elements.	semantic attributes	proper names	model-feature	{'e1': {'word': 'semantic attributes', 'word_index': [(10, 11)], 'id': 'W93-0105.13'}, 'e2': {'word': 'proper names', 'word_index': [(8, 9)], 'id': 'W93-0105.12'}}	paper describes system uses text skimming techniques deriving proper names semantic attributes automatically newswire text , without relying listing name elements .
In order to identify new names, the system treats proper names as (potentially) context-dependent linguistic expressions.	context-dependent linguistic expressions	proper names	model-feature	{'e1': {'word': 'context-dependent linguistic expressions', 'word_index': [(12, 14)], 'id': 'W93-0105.17'}, 'e2': {'word': 'proper names', 'word_index': [(7, 8)], 'id': 'W93-0105.16'}}	order identify new names , system treats proper names ( potentially ) context-dependent linguistic expressions .
In addition to using information in the local context, the system exploits a computational model of discourse which identifies individuals based on the way they are described in the text, instead of relying on their description in a pre-existing knowledge base.	information	local context	part_whole	{'e1': {'word': 'information', 'word_index': [(2, 2)], 'id': 'W93-0105.18'}, 'e2': {'word': 'local context', 'word_index': [(3, 4)], 'id': 'W93-0105.19'}}	addition using information local context , system exploits computational model discourse identifies individuals based way described text , instead relying description pre-existing knowledge base .
Some entities belong more or less to a class.	entities	class	part_whole	{'e1': {'word': 'entities', 'word_index': [(0, 0)], 'id': 'L08-1274.2'}, 'e2': {'word': 'class', 'word_index': [(3, 3)], 'id': 'L08-1274.3'}}	entities belong less class .
To specify whether an individual entity belonging to a class is typical or not, we borrow the topological concepts of interior, border, closure, and exterior.	entity	class	part_whole	{'e1': {'word': 'entity', 'word_index': [(3, 3)], 'id': 'L08-1274.8'}, 'e2': {'word': 'class', 'word_index': [(5, 5)], 'id': 'L08-1274.9'}}	specify whether individual entity belonging class typical , borrow topological concepts interior , border , closure , exterior .
It enables to define levels of typicality where individual entities are more or less typical elements of a concept.	entities	concept	model-feature	{'e1': {'word': 'entities', 'word_index': [(5, 5)], 'id': 'L08-1274.16'}, 'e2': {'word': 'concept', 'word_index': [(9, 9)], 'id': 'L08-1274.17'}}	enables define levels typicality individual entities less typical elements concept .
WordNet has been used extensively as a resource for the Word Sense Disambiguation (WSD) task, both as a sense inventory and a repository of semantic relationships.	WordNet	Word Sense Disambiguation (WSD) task	usage	{'e1': {'word': 'WordNet', 'word_index': [(0, 0)], 'id': 'L08-1598.1'}, 'e2': {'word': 'Word Sense Disambiguation (WSD) task', 'word_index': [(4, 10)], 'id': 'L08-1598.2'}}	WordNet used extensively resource Word Sense Disambiguation ( WSD ) task , sense inventory repository semantic relationships .
We found that it would be very useful to assign to geographical entities in WordNet their coordinates, especially in order to implement geometric shape-based disambiguation methods.	geographical entities	WordNet	part_whole	{'e1': {'word': 'geographical entities', 'word_index': [(4, 5)], 'id': 'L08-1598.9'}, 'e2': {'word': 'WordNet', 'word_index': [(6, 7)], 'id': 'L08-1598.10'}}	found would useful assign geographical entities Word Net coordinates , especially order implement geometric shape - based disambiguation methods .
The annotation has been carried out by extracting geographical synsets from WordNet, together with their holonyms and hypernyms, and comparing them to the entries in the Wikipedia-World geographical database.	geographical synsets	WordNet	part_whole	{'e1': {'word': 'geographical synsets', 'word_index': [(3, 4)], 'id': 'L08-1598.17'}, 'e2': {'word': 'WordNet', 'word_index': [(5, 5)], 'id': 'L08-1598.18'}}	annotation carried extracting geographical synsets WordNet , together holonyms hypernyms , comparing entries Wikipedia - World geographical database .
A weight was calculated for each of the candidate annotations, on the basis of matches found between the database entries and synset gloss, holonyms and hypernyms.	weight	candidate annotations	model-feature	{'e1': {'word': 'weight', 'word_index': [(0, 0)], 'id': 'L08-1598.22'}, 'e2': {'word': 'candidate annotations', 'word_index': [(2, 3)], 'id': 'L08-1598.23'}}	weight calculated candidate annotations , basis matches found database entries synset gloss , holonyms hypernyms .
"""We present a robust summarisation system developed within the GATE architecture that makes use of robust components for semantic tagging and coreference resolution provided by GATE."	robust components	semantic tagging	usage	{'e1': {'word': 'robust components', 'word_index': [(11, 12)], 'id': 'E03-2013.3'}, 'e2': {'word': 'semantic tagging', 'word_index': [(13, 14)], 'id': 'E03-2013.4'}}	""" present robust summarisation system developed within GATE architecture makes use robust components semantic tagging coreference resolution provided GATE ."
Our system combines GATE components with well established statistical techniques developed for the purpose of text summarisation research.	statistical techniques	text summarisation research	usage	{'e1': {'word': 'statistical techniques', 'word_index': [(6, 7)], 'id': 'E03-2013.9'}, 'e2': {'word': 'text summarisation research', 'word_index': [(10, 12)], 'id': 'E03-2013.10'}}	system combines GATE components well established statistical techniques developed purpose text summarisation research .
Prior to MUC-4, LINK had been used to extract information from free-form texts in two narrow application domains.	information	free-form texts	part_whole	{'e1': {'word': 'information', 'word_index': [(7, 7)], 'id': 'M92-1039.6'}, 'e2': {'word': 'free-form texts', 'word_index': [(9, 12)], 'id': 'M92-1039.7'}}	Prior MUC -4 , LINK had to information from free - form texts in narrow application domains .
One application corpus contained terse descriptions of symptoms displayed by malfunctioning automobiles, and the repairs which fixed them.	terse descriptions	application corpus	part_whole	{'e1': {'word': 'terse descriptions', 'word_index': [(4, 5)], 'id': 'M92-1039.10'}, 'e2': {'word': 'application corpus', 'word_index': [(1, 2)], 'id': 'M92-1039.9'}}	One application corpus contained terse descriptions symptoms displayed malfunctioning automobiles , repairs fixed .
In empirical testing in these two domains, LINK correctly processed 70% of previously unseen descriptions.	LINK	descriptions	usage	{'e1': {'word': 'LINK', 'word_index': [(5, 5)], 'id': 'M92-1039.15'}, 'e2': {'word': 'descriptions', 'word_index': [(12, 12)], 'id': 'M92-1039.16'}}	empirical testing two domains , LINK correctly processed 70 % previously unseen descriptions .
A template was counted as correct only if all of the fillers in the template were filled correctly.	fillers	template	part_whole	{'e1': {'word': 'fillers', 'word_index': [(3, 3)], 'id': 'M92-1039.18'}, 'e2': {'word': 'template', 'word_index': [(4, 4)], 'id': 'M92-1039.19'}}	template counted correct fillers template filled correctly .
These previous domains were much narrower than the MUC-4 terrorism domain.	domains	MUC-4 terrorism domain	compare	{'e1': {'word': 'domains', 'word_index': [(1, 1)], 'id': 'M92-1039.23'}, 'e2': {'word': 'MUC-4 terrorism domain', 'word_index': [(4, 8)], 'id': 'M92-1039.24'}}	previous domains much narrower MUC - 4 terrorism domain .
As a comparison, the lexicons for the previous domains contained only 300-500 words, compared with 6700 words in our MUC-4 test configuration.	words	lexicons	part_whole	{'e1': {'word': 'words', 'word_index': [(9, 9)], 'id': 'M92-1039.27'}, 'e2': {'word': 'lexicons', 'word_index': [(2, 2)], 'id': 'M92-1039.25'}}	comparison , lexicons previous domains contained 300 - 500 words , compared 6700 words MUC - 4 test configuration .
Previous grammar size ranged from 75-100 rules, compared with over 500 rules in the MUC-4 knowledge base.	grammar size	MUC-4 knowledge base	compare	{'e1': {'word': 'grammar size', 'word_index': [(1, 2)], 'id': 'M92-1039.30'}, 'e2': {'word': 'MUC-4 knowledge base', 'word_index': [(12, 16)], 'id': 'M92-1039.33'}}	Previous grammar size ranged 75 - 100 rules , compared 500 rules MUC - 4 knowledge base .
Thus, the integration of information from multiple sentences was not an issue in our previous work.	information	sentences	part_whole	{'e1': {'word': 'information', 'word_index': [(3, 3)], 'id': 'M92-1039.36'}, 'e2': {'word': 'sentences', 'word_index': [(5, 5)], 'id': 'M92-1039.37'}}	Thus , integration information multiple sentences issue previous work .
Brief Summary of Objectives: There are three objectives of the contract: to perform research and development in parallel parsing, semantic representation, ill-formed input, discourse, and tools for linguistic knowledge acquisition, and to integrate software components from BBN and elsewhere to produce Janus, DARPA's New Generation Natural Language Interface, and to demonstrate state-of-the-art natural language technology in DARPA applications.	language technology	DARPA applications	usage	{'e1': {'word': 'language technology', 'word_index': [(52, 53)], 'id': 'H89-2057.8'}, 'e2': {'word': 'DARPA applications', 'word_index': [(54, 55)], 'id': 'H89-2057.9'}}	Brief Summary Objectives : three objectives contract : perform research development parallel parsing , semantic representation , ill - formed input , discourse , tools linguistic knowledge acquisition , integrate software components BBN elsewhere produce Janus , DARPA 's New Generation Natural Language Interface , demonstrate state - - - art natural language technology DARPA applications .
In this paper, we introduce Tree-Based Pattern representation where a pattern is denoted as a path in the dependency tree of a sentence.	dependency tree	sentence	model-feature	{'e1': {'word': 'dependency tree', 'word_index': [(11, 12)], 'id': 'H01-1009.11'}, 'e2': {'word': 'sentence', 'word_index': [(13, 13)], 'id': 'H01-1009.12'}}	paper , introduce Tree - Based Pattern representation pattern denoted path dependency tree sentence .
We outline the procedure to acquire Tree-Based Patterns in Japanese from un-annotated text.	Tree-Based Patterns	un-annotated text	part_whole	{'e1': {'word': 'Tree-Based Patterns', 'word_index': [(3, 6)], 'id': 'H01-1009.13'}, 'e2': {'word': 'un-annotated text', 'word_index': [(8, 11)], 'id': 'H01-1009.15'}}	outline procedure acquire Tree - Based Patterns Japanese un - annotated text .
The system extracts the relevant sentences from the training data based on TF/IDF scoring and the common paths in the parse tree of relevant sentences are taken as extracted patterns.	sentences	training data	part_whole	{'e1': {'word': 'sentences', 'word_index': [(3, 3)], 'id': 'H01-1009.16'}, 'e2': {'word': 'training data', 'word_index': [(4, 5)], 'id': 'H01-1009.17'}}	system extracts relevant sentences training data based TF / IDF scoring common paths parse tree relevant sentences taken extracted patterns .
The system extracts the relevant sentences from the training data based on TF/IDF scoring and the common paths in the parse tree of relevant sentences are taken as extracted patterns.	parse tree	sentences	model-feature	{'e1': {'word': 'parse tree', 'word_index': [(13, 14)], 'id': 'H01-1009.20'}, 'e2': {'word': 'sentences', 'word_index': [(16, 16)], 'id': 'H01-1009.21'}}	system extracts relevant sentences training data based TF / IDF scoring common paths parse tree relevant sentences taken extracted patterns .
To overcome this problem, we present in this paper a procedure for the automatic extraction of application-tuned consistent subgrammars from proved large-scale generation grammars.	application-tuned consistent subgrammars	large-scale generation grammars	part_whole	{'e1': {'word': 'application-tuned consistent subgrammars', 'word_index': [(8, 12)], 'id': 'W97-1507.6'}, 'e2': {'word': 'large-scale generation grammars', 'word_index': [(14, 18)], 'id': 'W97-1507.7'}}	overcome problem , present paper procedure automatic extraction application - tuned consistent subgrammars proved large - scale generation grammars .
The procedure has been implemented for large-scale systemic grammars and builds on the formal equivalence between systemic grammars and typed unification based grammars.	systemic grammars	typed unification based grammars	compare	{'e1': {'word': 'systemic grammars', 'word_index': [(10, 11)], 'id': 'W97-1507.10'}, 'e2': {'word': 'typed unification based grammars', 'word_index': [(12, 15)], 'id': 'W97-1507.11'}}	procedure implemented large - scale systemic grammars builds formal equivalence systemic grammars typed unification based grammars .
First, the task has been performed traditionally using heuristics from the domain.	heuristics	task	usage	{'e1': {'word': 'heuristics', 'word_index': [(6, 6)], 'id': 'W00-0719.4'}, 'e2': {'word': 'task', 'word_index': [(2, 2)], 'id': 'W00-0719.3'}}	First , task performed traditionally using heuristics domain .
We present a comparative evaluation of several machine learning algorithms applied to spam filtering, considering the text of the messages and a set of heuristics for the task.	machine learning algorithms	spam filtering	usage	{'e1': {'word': 'machine learning algorithms', 'word_index': [(4, 6)], 'id': 'W00-0719.10'}, 'e2': {'word': 'spam filtering', 'word_index': [(8, 9)], 'id': 'W00-0719.11'}}	present comparative evaluation several machine learning algorithms applied spam filtering , considering text messages set heuristics task .
We present a comparative evaluation of several machine learning algorithms applied to spam filtering, considering the text of the messages and a set of heuristics for the task.	heuristics	task	usage	{'e1': {'word': 'heuristics', 'word_index': [(15, 15)], 'id': 'W00-0719.14'}, 'e2': {'word': 'task', 'word_index': [(16, 16)], 'id': 'W00-0719.15'}}	present comparative evaluation several machine learning algorithms applied spam filtering , considering text messages set heuristics task .
The framework includes a dialog history that tracks input, output, and results.	dialog history	framework	part_whole	{'e1': {'word': 'dialog history', 'word_index': [(2, 3)], 'id': 'W02-0209.11'}, 'e2': {'word': 'framework', 'word_index': [(0, 0)], 'id': 'W02-0209.10'}}	framework includes dialog history tracks input , output , results .
We present the framework and preliminary results in two application domains.	framework	application domains	usage	{'e1': {'word': 'framework', 'word_index': [(1, 1)], 'id': 'W02-0209.12'}, 'e2': {'word': 'application domains', 'word_index': [(5, 6)], 'id': 'W02-0209.13'}}	present framework preliminary results two application domains .
Near-perfect automatic accent assignment is attainable for citation-style speech, but better computational models are needed to predict accent in extended, spontaneous discourses.	automatic accent assignment	citation-style speech	usage	{'e1': {'word': 'automatic accent assignment', 'word_index': [(1, 3)], 'id': 'P98-2155.1'}, 'e2': {'word': 'citation-style speech', 'word_index': [(5, 8)], 'id': 'P98-2155.2'}}	Near-perfect automatic accent assignment attainable citation - style speech , better computational models needed predict accent extended , spontaneous discourses .
Near-perfect automatic accent assignment is attainable for citation-style speech, but better computational models are needed to predict accent in extended, spontaneous discourses.	computational models	extended, spontaneous discourses	usage	{'e1': {'word': 'computational models', 'word_index': [(11, 12)], 'id': 'P98-2155.3'}, 'e2': {'word': 'extended, spontaneous discourses', 'word_index': [(16, 19)], 'id': 'P98-2155.5'}}	Near-perfect automatic accent assignment attainable citation - style speech , better computational models needed predict accent extended , spontaneous discourses .
Machine learning experiments on 1031 noun phrases from eighteen spontaneous direction-giving monologues show that accent assignment can be significantly improved by up to 4%-6% relative to a hypothetical baseline system that would produce only citation-form accentuation, giving error rate reductions of 11%-25%.	Machine learning experiments	noun phrases	usage	{'e1': {'word': 'Machine learning experiments', 'word_index': [(0, 2)], 'id': 'P98-2155.16'}, 'e2': {'word': 'noun phrases', 'word_index': [(4, 5)], 'id': 'P98-2155.17'}}	Machine learning experiments 1031 noun phrases eighteen spontaneous direction - giving monologues show accent assignment significantly improved 4 % - 6 % relative hypothetical baseline system would produce citation - form accentuation , giving error rate reductions 11 % - 25 % .
A key task in an extraction system for query-oriented multi-document summarisation, necessary for computing relevance and redundancy, is modelling text semantics.	extraction system	query-oriented multi-document summarisation	usage	{'e1': {'word': 'extraction system', 'word_index': [(2, 3)], 'id': 'W06-0701.1'}, 'e2': {'word': 'query-oriented multi-document summarisation', 'word_index': [(4, 6)], 'id': 'W06-0701.2'}}	key task extraction system query-oriented multi-document summarisation , necessary computing relevance redundancy , modelling text semantics .
Accurate dependency recovery has recently been reported for a number of wide-coverage statistical parsers using Combinatory Categorial Grammar (ccg).	Combinatory Categorial Grammar (ccg)	wide-coverage statistical parsers	usage	{'e1': {'word': 'Combinatory Categorial Grammar (ccg)', 'word_index': [(12, 17)], 'id': 'W04-3215.3'}, 'e2': {'word': 'wide-coverage statistical parsers', 'word_index': [(6, 10)], 'id': 'W04-3215.2'}}	Accurate dependency recovery recently reported number wide - coverage statistical parsers using Combinatory Categorial Grammar ( ccg ) .
However, overall figures give no indication of a parser's performance on specific constructions, nor how suitable a parser is for specific applications.	parser	applications	usage	{'e1': {'word': 'parser', 'word_index': [(13, 13)], 'id': 'W04-3215.6'}, 'e2': {'word': 'applications', 'word_index': [(15, 15)], 'id': 'W04-3215.7'}}	However , overall figures give indication parser 's performance specific constructions , suitable parser specific applications .
In this paper we give a detailed evaluation of a ccg parser on object extraction dependencies found in wsj text.	object extraction dependencies	wsj text	part_whole	{'e1': {'word': 'object extraction dependencies', 'word_index': [(6, 8)], 'id': 'W04-3215.9'}, 'e2': {'word': 'wsj text', 'word_index': [(10, 11)], 'id': 'W04-3215.10'}}	paper give detailed evaluation ccg parser object extraction dependencies found wsj text .
We also show how the parser can be used to parse questions for Question Answering.	parser	questions	usage	{'e1': {'word': 'parser', 'word_index': [(2, 2)], 'id': 'W04-3215.11'}, 'e2': {'word': 'questions', 'word_index': [(5, 5)], 'id': 'W04-3215.12'}}	also show parser used parse questions Question Answering .
The accuracy of the original parser on questions is very poor, and we propose a novel technique for porting the parser to a new domain, by creating new labelled data at the lexical category level only.	parser	accuracy	result	{'e1': {'word': 'parser', 'word_index': [(2, 2)], 'id': 'W04-3215.15'}, 'e2': {'word': 'accuracy', 'word_index': [(0, 0)], 'id': 'W04-3215.14'}}	accuracy original parser questions poor , propose novel technique porting parser new domain , creating new labelled data lexical category level .
Using a supertagger to assign categories to words, trained on the new data, leads to a dramatic increase in question parsing accuracy.	categories	words	model-feature	{'e1': {'word': 'categories', 'word_index': [(3, 3)], 'id': 'W04-3215.22'}, 'e2': {'word': 'words', 'word_index': [(4, 4)], 'id': 'W04-3215.23'}}	Using supertagger assign categories words , trained new data , leads dramatic increase question parsing accuracy .
This paper addresses syntax-based paraphrasing methods for Recognizing Textual Entailment (RTE).	syntax-based paraphrasing methods	Recognizing Textual Entailment (RTE)	usage	{'e1': {'word': 'syntax-based paraphrasing methods', 'word_index': [(2, 6)], 'id': 'W07-1414.1'}, 'e2': {'word': 'Recognizing Textual Entailment (RTE)', 'word_index': [(7, 12)], 'id': 'W07-1414.2'}}	paper addresses syntax - based paraphrasing methods Recognizing Textual Entailment ( RTE ) .
In particular, we describe a dependency-based paraphrasing algorithm, using the DIRT data set, and its application in the context of a straightforward RTE system based on aligning dependency trees.	DIRT data set	dependency-based paraphrasing algorithm	usage	{'e1': {'word': 'DIRT data set', 'word_index': [(10, 12)], 'id': 'W07-1414.4'}, 'e2': {'word': 'dependency-based paraphrasing algorithm', 'word_index': [(3, 7)], 'id': 'W07-1414.3'}}	particular , describe dependency - based paraphrasing algorithm , using DIRT data set , application context straightforward RTE system based aligning dependency trees .
The goal of the project is to provide a quantitative description of Polish preposition-pronoun contractions taking into consideration morphosyntactic properties of their components.	morphosyntactic properties	Polish preposition-pronoun contractions	model-feature	{'e1': {'word': 'morphosyntactic properties', 'word_index': [(12, 13)], 'id': 'W06-2103.6'}, 'e2': {'word': 'Polish preposition-pronoun contractions', 'word_index': [(5, 9)], 'id': 'W06-2103.5'}}	goal project provide quantitative description Polish preposition - pronoun contractions taking consideration morphosyntactic properties components .
The results of corpus-based investigations of the distribution of prepositions within preposition-pronoun contractions can be used for grammar-theoretical and lexicographic purposes.	distribution	prepositions	model-feature	{'e1': {'word': 'distribution', 'word_index': [(5, 5)], 'id': 'W06-2103.11'}, 'e2': {'word': 'prepositions', 'word_index': [(6, 6)], 'id': 'W06-2103.12'}}	results corpus - based investigations distribution prepositions within preposition - pronoun contractions used grammar-theoretical lexicographic purposes .
This paper presents a new unsupervised algorithm (WordEnds) for inferring word boundaries from transcribed adult conversations.	unsupervised algorithm	word boundaries	usage	{'e1': {'word': 'unsupervised algorithm', 'word_index': [(3, 4)], 'id': 'P08-1016.1'}, 'e2': {'word': 'word boundaries', 'word_index': [(10, 11)], 'id': 'P08-1016.3'}}	paper presents new unsupervised algorithm ( Word Ends ) inferring word boundaries transcribed adult conversations .
